{
  "$schema": "https://json-schema.org/draft/2020-12/schema",
  "$id": "issues.schema.json",
  "title": "Recovery Crawl Issues",
  "type": "object",
  "required": ["schema_version", "run_id", "data_quality", "confidence", "providers_used", "missing_capabilities", "status", "input_domain", "domain", "canonical_domain", "slug", "timestamp", "warnings", "errors", "crawled_internal_html_urls", "issues", "summary"],
  "properties": {
    "schema_version": { "type": "string", "const": "1.0.0" },
    "run_id": { "type": "string", "pattern": "^\\d{8}-\\d{6}-[a-z0-9]+$" },
    "data_quality": { "type": "string", "enum": ["good", "partial", "poor"] },
    "confidence": { "type": "string", "enum": ["high", "medium", "low"] },
    "providers_used": { "type": "array", "items": { "type": "string" } },
    "missing_capabilities": { "type": "array", "items": { "type": "string" } },
    "status": { "type": "string", "enum": ["complete", "partial", "failed"] },
    "input_domain": { "type": "string" },
    "domain": { "type": "string" },
    "canonical_domain": { "type": ["string", "null"] },
    "slug": { "type": "string", "pattern": "^[a-z0-9][a-z0-9_-]{0,63}$" },
    "timestamp": { "type": "string", "format": "date-time" },
    "warnings": { "type": "array", "items": { "type": "string" } },
    "errors": { "type": "array", "items": { "type": "string" } },
    "crawl_limit": { "type": "integer" },
    "crawled_internal_html_urls": { "type": "integer", "minimum": 0 },
    "exported_rows_total": { "type": "integer", "minimum": 0 },
    "raw_exports_used": { "type": "array", "items": { "type": "string" } },
    "crawler_provider": { "type": ["string", "null"], "description": "Set by the caller (e.g. screaming_frog_mcp, csv_import). null when the caller did not declare a provider — data_quality is then capped at partial." },
    "local_crawler_used": { "type": "boolean" },
    "issues": {
      "type": "array",
      "items": {
        "type": "object",
        "required": ["type", "severity", "count"],
        "properties": {
          "type": {
            "type": "string",
            "enum": ["broken_internal_link", "redirect_chain", "non_indexable_canonical", "missing_h1", "duplicate_h1", "missing_meta_description", "orphan_page", "shopware_url_resolver_conflict", "dreisc_301_404_chain", "duplicate_canonical_blog"]
          },
          "severity": { "type": "string", "enum": ["critical", "high", "medium", "low"] },
          "count": { "type": "integer", "minimum": 0 },
          "affected_urls": { "type": ["integer", "array"] },
          "details": { "type": "array" }
        }
      }
    },
    "summary": {
      "type": "object",
      "required": ["critical", "high", "medium", "low", "total_issues"],
      "properties": {
        "critical": { "type": "integer" },
        "high": { "type": "integer" },
        "medium": { "type": "integer" },
        "low": { "type": "integer" },
        "total_issues": { "type": "integer" }
      }
    }
  }
}
