{
  "schema_version": "1.0.0",
  "run_id": "20260527-211500-test02",
  "status": "partial",
  "input_domain": "www.example.com",
  "domain": "www.example.com",
  "canonical_domain": null,
  "slug": "www-example-com",
  "timestamp": "2026-05-27T21:15:00Z",
  "warnings": ["Using manual crawl CSV, limited coverage"],
  "errors": [],
  "data_quality": "partial",
  "confidence": "medium",
  "providers_used": ["manual_csv"],
  "missing_capabilities": [],
  "crawl_limit": 500,
  "crawled_internal_html_urls": 5,
  "exported_rows_total": 5,
  "raw_exports_used": ["response-codes", "h1", "meta-descriptions", "canonicals"],
  "crawler_provider": "manual_csv",
  "local_crawler_used": false,
  "issues": [
    { "type": "broken_internal_link", "severity": "high", "count": 2, "affected_urls": 2, "details": [] },
    { "type": "missing_h1", "severity": "medium", "count": 2, "affected_urls": ["/kontakt/", "/agb/"] },
    { "type": "missing_meta_description", "severity": "low", "count": 2, "affected_urls": ["/impressum/", "/datenschutz/"] }
  ],
  "summary": { "critical": 0, "high": 1, "medium": 1, "low": 1, "total_issues": 3 }
}
